{
  "id": "req-page-selection-analysis-smoke",
  "title": "Synthetic page selection and analysis workflow",
  "raw_text": "사용자가 데이터 분석 목적의 채팅 쿼리를 입력하면 Agent가 고객 행동 유형을 대/중/소로 분류하고, RAG 기반 페이지 검색 MCP Adapter에서 페이지 후보를 받은 뒤 특정 서비스의 page_id를 선택한다. 선택된 페이지에 추가 분석이 필요한 경우 유저플로우 분석, 고객행동 유형 분류 기반 시나리오 추천, Text to SQL 기반 페이지/고객 분석 중 하나를 실행하고, 최종 page_id와 분석 결과를 workflow2로 넘긴다. 모든 Adapter는 Mock Lab의 synthetic MCP server 한 개에서 동작한다.",
  "domain": "digital-channel-page-analysis",
  "requester": {
    "team": "agent-factory",
    "role": "developer"
  },
  "business_goal": "데이터 분석용 scenario design workflow의 1차 출력인 page_id 선정과 필요 시 추가 분석 수행을 검토 가능한 Agent Factory artifact와 실제 동작 가능한 Mock Lab MCP test double로 제공한다.",
  "current_process": [
    "사용자가 채팅으로 분석 쿼리와 시나리오 설계 목적을 입력한다.",
    "Agent가 시나리오 설계 목적과 대상 업무 영역을 바탕으로 고객 행동 유형을 대/중/소 분류한다.",
    "분류 결과와 쿼리를 RAG 페이지 검색 Adapter에 전달해 page 후보를 받는다.",
    "Agent가 후보 중 특정 서비스의 page_id를 선택하고 추가 분석 필요 여부를 판단한다.",
    "추가 분석이 필요하면 유저플로우, 행동유형 기반 시나리오 추천, Text to SQL 기반 분석 중 하나를 실행한다.",
    "최종 page_id, 선택 근거, 분석 결과를 workflow2 handoff payload로 만든다."
  ],
  "inputs": [
    {
      "name": "chat_query",
      "type": "text",
      "required": true
    },
    {
      "name": "scenario_design_purpose",
      "type": "text",
      "required": true
    },
    {
      "name": "scenario_target_business_domain",
      "type": "string",
      "required": true
    },
    {
      "name": "sql_text",
      "type": "text",
      "required": false
    }
  ],
  "outputs": [
    {
      "name": "customer_behavior_classification",
      "type": "object",
      "required": true
    },
    {
      "name": "selected_page_id",
      "type": "string",
      "required": true
    },
    {
      "name": "page_selection_decision",
      "type": "object",
      "required": true
    },
    {
      "name": "workflow2_handoff",
      "type": "object",
      "required": true
    }
  ],
  "systems": [
    {
      "name": "catalog/adapters.yaml",
      "access": "read"
    },
    {
      "name": "catalog/contracts/mcp/page_analysis.*.json",
      "access": "read"
    },
    {
      "name": "artifacts/mock-lab/page-analysis-mcp/mock-spec.json",
      "access": "read"
    }
  ],
  "risk_signals": [
    "financial_data",
    "customer_impact",
    "audit_required"
  ],
  "missing_information": [
    "workflow2의 정확한 입력 schema와 승인 gate는 아직 제공되지 않았으므로 handoff payload는 synthetic contract로 제한한다.",
    "고객 행동 유형 대/중/소 taxonomy의 실제 운영 카테고리 전문은 제공되지 않았으므로 Agent prompt가 알고 있는 분류체계라는 가정으로 synthetic 예시 taxonomy를 둔다."
  ],
  "contradictions": [],
  "status": "approved"
}
