{
  "id": "req-loan-precheck-smoke",
  "title": "Synthetic loan precheck graph runtime handoff",
  "raw_text": "대출 신청과 제출 문서를 받아 OCR/정책 근거, 고객 snapshot, rule 평가, 문서 검토, 위험 설명, 고객 안내 템플릿 preview를 순서대로 묶는 local smoke graph를 만든다. 모든 데이터는 catalog의 synthetic mock만 사용하고 실제 신용 판단, 고객 발송, private endpoint는 포함하지 않는다.",
  "domain": "loan-precheck-demo",
  "requester": {
    "team": "agent-factory",
    "role": "developer"
  },
  "business_goal": "현재 catalog와 문서를 기반으로 Analyze, Design, Build 화면에서 검토 가능한 완성도 높은 scaffold-ready 예제를 제공한다.",
  "current_process": [
    "대출 신청과 제출 문서 package를 수신한다.",
    "공통 문서 intake workflow로 document_context를 만든다.",
    "고객/account snapshot과 rule result를 synthetic adapter에서 받는다.",
    "서류 검토 Agent와 위험 설명 Agent가 담당자 검토 근거를 만든다.",
    "고객 안내 템플릿은 외부 발송 없이 internal preview만 생성한다."
  ],
  "inputs": [
    {
      "name": "loan_application",
      "type": "object",
      "required": true
    },
    {
      "name": "submitted_documents",
      "type": "array<object>",
      "required": true
    }
  ],
  "outputs": [
    {
      "name": "precheck_result",
      "type": "object",
      "required": true
    },
    {
      "name": "approval_required",
      "type": "boolean",
      "required": true
    },
    {
      "name": "next_actions",
      "type": "array<string>",
      "required": true
    }
  ],
  "systems": [
    {
      "name": "catalog/workflows.yaml",
      "access": "read"
    },
    {
      "name": "catalog/adapters.yaml",
      "access": "read"
    },
    {
      "name": "catalog/agents.yaml",
      "access": "read"
    }
  ],
  "risk_signals": [
    "personal_data",
    "financial_data",
    "credit_decision_support",
    "customer_impact",
    "external_message",
    "human_approval_required",
    "audit_required"
  ],
  "missing_information": [],
  "contradictions": [],
  "status": "approved"
}
